02:13:35.629134 IP 10.137.0.30.32919 > 10.139.1.1.domain: 52356+ A? example.com. (29)
02:13:35.629151 IP 10.137.0.30.32919 > 10.139.1.1.domain: 44418+ AAAA? example.com. (29)
02:13:35.629667 IP 10.137.0.30.60034 > 10.139.1.1.domain: 6965+ A? example.com. (29)
02:13:35.636775 IP 10.139.1.1.domain > 10.137.0.30.60034: 6965 1/0/0 A 93.184.215.14 (45)
02:13:35.636801 IP 10.139.1.1.domain > 10.137.0.30.32919: 52356 1/0/0 A 93.184.215.14 (45)
02:13:35.636801 IP 10.139.1.1.domain > 10.137.0.30.32919: 44418 1/0/0 AAAA 2606:2800:21f:cb07:6820:80da:af6b:8b2c (57)
02:13:35.637008 IP 10.137.0.30.47316 > 93.184.215.14.http: Flags [S], seq 1426550636, win 64240, options [mss 1460,nop,nop,sackOK,nop,wscale 6], length 0
02:13:35.645489 IP 93.184.215.14.http > 10.137.0.30.47316: Flags [S.], seq 1702214329, ack 1426550637, win 65535, options [mss 1460,nop,nop,sackOK,nop,wscale 9], length 0
02:13:35.645509 IP 10.137.0.30.47316 > 93.184.215.14.http: Flags [.], ack 1, win 1004, length 0
02:13:35.645600 IP 10.137.0.30.47316 > 93.184.215.14.http: Flags [P.], seq 1:420, ack 1, win 1004, length 419: HTTP: GET / HTTP/1.1
02:13:35.656105 IP 93.184.215.14.http > 10.137.0.30.47316: Flags [.], ack 420, win 131, length 0
02:13:35.656105 IP 93.184.215.14.http > 10.137.0.30.47316: Flags [P.], seq 1:285, ack 420, win 131, length 284: HTTP: HTTP/1.1 304 Not Modified
02:13:35.656141 IP 10.137.0.30.47316 > 93.184.215.14.http: Flags [.], ack 285, win 1000, length 0
02:13:35.692817 IP 10.137.0.30.57625 > 10.139.1.1.domain: 14356+ A? www.iana.org. (30)
02:13:35.692835 IP 10.137.0.30.57625 > 10.139.1.1.domain: 64025+ AAAA? www.iana.org. (30)
02:13:35.701900 IP 10.139.1.1.domain > 10.137.0.30.57625: 14356 2/0/0 CNAME ianawww.vip.icann.org., A 192.0.33.8 (78)
02:13:35.711170 IP 10.139.1.1.domain > 10.137.0.30.57625: 64025 2/0/0 CNAME ianawww.vip.icann.org., AAAA 2620:0:2d0:200::b:8 (93)
02:13:36.516595 IP 10.137.0.30.46319 > 10.139.1.1.domain: 625+ PTR? 1.1.139.10.in-addr.arpa. (41)
02:13:36.523328 IP 10.139.1.1.domain > 10.137.0.30.46319: 625 NXDomain* 0/0/0 (41)
02:13:36.523481 IP 10.137.0.30.36247 > 10.139.1.1.domain: 38511+ PTR? 30.0.137.10.in-addr.arpa. (42)
02:13:36.529497 IP 10.139.1.1.domain > 10.137.0.30.36247: 38511 NXDomain* 0/0/0 (42)
02:13:36.529709 IP 10.137.0.30.39702 > 10.139.1.1.domain: 3460+ PTR? 14.215.184.93.in-addr.arpa. (44)
02:13:36.532612 IP 10.139.1.1.domain > 10.137.0.30.39702: 3460 NXDomain 0/0/0 (44)

